Call 262,"I'm looking at becoming a vehicle broker, I'll source a vehicle and then introduce the customer to a lender. Do I need FCA approval?"Call 263,"We're looking to offer our services where the customer can spread the costs and pay via instalments, would this require authorising?"Call 264,We've been told we need to apply for a Consumer Credit licence to allow our members to pay by instalments through us directly. Is this correct?Call 265,"I'm setting up a business where I've had a Consumer Credit licence prior, we just introduce customers to a lende. Do I need to re-apply?"Call 266,"We want to refer our customers on to a 3rd party lender, do we need to be FCA limited permission authorised?"Call 267,"We're looking to rent vehicles out which are registered as taxis, Do I need to be authorised for that?"Call 268,"I complete income expenditure and advise clients to amalgamate debts, do I need to be authorised?"Call 269,"When people have defaulted on payments of cars, we would start the process to collect the debts do we need to be authorised?"Call 270,I'm a caravan dealer and I need to be FCA approved to work with Black horse finance for credit broking. How do it?Call 271,"I'm setting up a website for contract hire vehicles, I've been told I may need to FCA registered to hire is that correct?"Call 272,We want to offer finance to our customers so they have the option to get interest free finance which we will sort elsewhere. Do we have to do it through you?Call 273,If we offer in-house finance do I need full or limited permission?Call 274,"We're motor dealers buying & selling cars, we want to be FCA authorised to send customers to finance companies and they need us to be FCA approved. What do we do?"Call 275,"We're looking to lease security systems, we own the goods do we need to be authorised?"Call 276,"We're looking to offer finance to our customers through a finance provider, I've been told I need to apply for Consumer Credit Limited Permission. How do it?"Call 277,Do I need to be authorised to collect debt on a tenancy agreement?Call 278,"Looking to credit consumer licence, been told to come to FCA and get a licence form you so can deal with the finance company."Call 279,anyone advertising loans would they have to be regulated by yourselves or anybody in the UK?Call 280,"thinking of setting up like a money lending, pawnbroking for high end cars, need to find out if we need to be FCA regulated."Call 281,"Home improvement business, looking to set up a facility where can get a licence to, I want to be able to offer them  finance?"Call 282,I need some guidance as a new company we're about to launch and looking to operate a crowdfunding platform for loans which is interest free for the general public. What do we need?