Call 139,"I'm trying ot work out whether we should be FCA authorised. So we are a claims management company helping consumers reclaim missold products like PPI. Some of the customers at the end of the service when we've had a good outcome aren't able to meet the invoice payment in full when it's due. And we offer a very small number of customers, time to pay over some installments. So there's no interest or charge, it's not the primary part of the business, it's only for some people that are in financial difficulty maybe and as I say, can't pay. I don't think we require authorisation, but I'm calling to check. "Call 140,"I work, and have done, you know, doing personal loans, door to door collections for many many years and I was considering going out on my own, and I just don't know how to go about it. I know I have to be registered with yourselves and everything. I just thought it'd be better to give you a ring and talk through with you what I need to do, and what I need to have and stuff. "Call 141,I wanrt to apply for a consumer credit licence.Call 142,"I want to give credit to my customers, I'm buying and selling cars. I'll be passing them onto the third party "Call 143,"So I am basically looking to set up a business. I want to be able to be charging the customer, how do you call it, they pay in installments like direct debit in. So I was told I have to call you guys and you'll point me to the right ddirection. I'm calling to know my options and how to start the whole process. "Call 144,"I'm looking to set up an automobile company where I buy and sell used cars. So my enquiry has got to do with how customers will repay me by installments, by direct debit or finance.  "Call 145,We're looking into the FCA licence whether or not we need one and require one for our business. Call 146,"What we are, are a vehicle tracking company . Basically we fit trackers to vehicles and hire them over long term for businesses. But we're also looking at bigger contracts, where we will use financial services for the leasing. So it's been brought to our attention that we may need a licence for the way we work. So we rent equipment over the long term and get money in monthly from those people for that equipment."Call 147,"I'm making an enquiry as to whether I need to get one of those, what is it? A consumer licence? "Call 148,"We've recently registered a car rental firm now short term car hire would lead to one months. My partner weanted to stretch it out to three months. Now I was told by an accountant friend that if it's three months or over, then it would need a consumer credit licence. We just hire them, short term hire."Call 149,I'm calling from a dental practice. We want to actually apply for the FCA and I was just wondering what link we need to do that. Call 150,"So basically our patients get finance, but it's only for twelve months so, by applying for the FCA, they can have finance over twelve months is that correct? "Call 151,"Basically it's going to be a website with information, I'm thinking to help people find the right credit product. I was thinking to match people with the bank, the financial institution to offer them the best possible products to borrow some money. I was just thinking, do I need any special permissions, do I need any licence for that?"Call 152,"My question is about whether I need to register with yorselves. We want to start charging annual fees for over, you know, divided by twelve payments so clients can spread their payments. And I'm not sure if that's something that we need to be  registered and regulated for? So is that, doing that, is that classed as giving credit then?"Call 153,"Ok well, now we just acquired a company that went into liquidation. Now they had a consumer credit licence, I think and we don't have one in our other business, we don't require one. I'm just thinking they had one, so we perhaps need one, I'm just wondering what we need to do, I don't suppose we can transfer it over so I think maybe we have to apply. Now what the new company does, we manufacture DIY cleaning equipment and then install it in the client's house normally and then they will pay direct debit on a monthly direct debit usually on a three year hire agreement.  "Call 154,I'm just enquiring whether or not we need limited permissions for our current operations and also whether or not we need something in place if we're looking at having leasing agreements in place for people to be able to afford what we sell.Call 155,"We don't do any leasing agreements at the moment. What we're looking to do, we have a website and we sell visual equipment on the website, that's part of our business, most of our business installation systems in theatres and things. We get into a leasing agreement where we could have a broker who obviously takes it over for us. Would that be covered by your credit broking part on the regulated activities on the limited permissions?"Call 156,What would be classed as a broker?Call 157,"I run a franchise, I'm a retailer of home improvement products. What I would like to do, is to offer retail credit to my clients, between 0% over 12 months or with varying APRs between 12 and 48 months. So what kind of registration do I need for that?"Call 158,"I've got a small business, I sell a few cars every year basically. I just want to be authorised to be able to offer finance. I just wondered what's involved."Call 159,I'm in the early stages of setting up a company and I just really wanted to run the business idea past you and for you to give me some guidance or some advice on if I would need to be authorised or what sort of licence I would need if I were to be authorisedCall 160,"So, we're going ot set up a broker, say, if someone's leasing a car, we want to set up a company, a website, where people, if they want to get out of their lease, can go to. Basically we'll be negotiating between two parties, a buyer and a seller. We're not going to be talking about their, well, we are going to be talking about their payments, but we're not going to be giving any payments or any quote, we're only going to be acting as a broker. "Call 161,"It¡¯s just a query , if you can answer a query for me please. I'm looking at advising a company on getting an authorisation, a Financial Conduct Authority authorisation, either a full permission or a limited permission on consumer credit activities. It was just a question on whether this company should be limited or full permission if you don't mind "Call 162,"It's a busines that effectively sells door. What they do is go out and get an enquiry for a door, they'll go out and measure up a door and maybe give a price to a customer when they measure the door. And then the idea is they may, I don't know yet how they'll do this, but they'll give the customer a price for the door. At the moment if the customer wants to go ahead, they'll maybe take a depsoit and then process the order. But then if they do decide to offer credit facilities, then they'll give the customer a price, and maybe say, you can take this on 12 months interest free perhaps and leave the quotation with the customer and the idea would be any documentation and communication with the customer after that would be with the head office on telephone or email basis. The lender would be either Barclays or Hitachi. "Call 163,"I just need some advice as to whether we actually need to be registered with the Financial Conduct Authority. It's an IT firm, we provide broadband information to businesses, commercial firms and we offer leases of equipment as well. They own it at the end of the agreement "Call 164,"I just need some information, bit of a fact find. I need to apply for full permissions as I'm looking at opening up a brokerage. What is it we need to do, how do we go from here? So it's going to be broker activities on car finance."Call 165,"I'm just trying to do some research for my own mind, are you able to help me on a general level? I understand if we are looking at school fees payments etcetera and I understand we may need a licence category C. I wondered if you could confirm that wwas the case"Call 166,"We're a used truck dealership, we have no in house financial services, the only thing that we do do is we, if our customer requires some financial help, obviously paying for a vehicle, we refer them, or we give them a telephone number for a brokers. Now, I wanted to know what kind of, do we need to be registered, do we need to be authorised, what do we need to do in terms of, you know, the FCA. "Call 167,"So I've got a buyer and a seller. I'm buying an invoice from the seller, I take on his debt, I give him the money and I hold onto that for 120 days, and then I receive the money from the buyer. I'm sitting in the middle, I'm taking ownership of the debt. Do I need to be registered with you?"Call 168,"My question is, I want to start a motor trade business joint with some financial companies. The requirement is that I should have a credit licence from the FCA. How do I have to do that?"Call 169,"We supply therapy products and stuff like that and we use a financial service firm to do credit limits and they're called Close Brothers and it's consumer credits firms, so people spreading payments. We're looking at using interest bearing credit limits so we can get longer terms with them. And I'm just currently trying to find out how we apply, what we apply as and then the fees around that"Call 170,"I'm looking to set up a debt collection agency and I want some advice what basically do I need, do I need to be registered with any bodies or anything like that. "Call 171,"We're a jewellers actually and I'm phoning up with the view to getting a consumer credit licence, because we'd like to go into pawnbroking this year. "Call 172,Well I'm an accountant and I have a client who sells caravans. He wants to refer his customers to someone who will give them lending to buy the caravan but not on HP. He's wondering if he needs to be regulated in some way through the FCA or whether it¡¯s the other party that needs to be regulated.Call 173,"So we are a small and start up motor trade company. We trade in used cars, starting a few months still trading from home. We have got the company as limited, but as with any other used car vendor, we are receiving calls from customers to offer options for finance as such.  "Call 174,"Who would obviously be authorised to do that? For actually the purpose of selling the car, because if a customer wants the car and they don't have the money, they need someone to finance it. "Call 175,"I was just phoning for some advice, because I'm not sure if it would be required and if it is, I just wanted to know how, potentially, to be authorised. So, mobility research UK is a company I started last year, it's a UK supplier for a medical device. We're often asked if we can offer finance, the equivalent is quite expensive. I understand if you want to offer finance you have to authorised by yourselves. So I looked at third party companies and they charge quite a high interest. I was just wondering what's the guidelines with offering just part payment without any interest as such, for equipment? "Call 176,"So we're a very large organisation and we've been running a cycle to work scheme now for the at few years. And I know we're covered under that in terms of consumer credit licences because it's up to ¡ê1000. But this year we're actually changing the release dates so instead of having it august like we normally do, it's now going to be changed to earlier, like April/May time, which means there will be some people who will be overlapping. How does this affact us? "Call 177,We've been told by Halfords that if we have a consumer credit licence we'd able to offer finance. Call 178,"I was looking to, I'm, a self-employed car dealer, who's looking at offering customers finance. One of the brokers has said I need to get an FCA licence, I'm just enquiring about what was the process of getting that licence."Call 179,We're setting up a new care sales retail outlet so we need to apply for a consumer credit licence. Because we're going to offering finance and what not.Call 180,"All I know, a consumer credit licence, you have to apply for it, you have to pay for it and once you've got it, then you can offer finance deals on the cars. "Call 181,"We want to apply for a consumer credit licence and I'm trying to figure out what type of licence we actually need. Basically what we are, we're a car sales company and we're going to be sending information to like a third party broker and they're going to do all the finance side of things, all we're going to be doing is getting the names and addresses of people and then forwarding it on to them. What kind of licence do I need and what do I need to fill in and so on?"Call 182,As a business I want to get limited permission authorisation so that I can offer finance to my customers. Is that possible?Call 183,"I want to offer finance to the customers, there are two types of customer, one who would buy a boiler and second, the ASOC pumps. Now AOSC pumps, they will be offered some kind of home improvement loan. So what kind of category licence do I need?"Call 184,I'm a car dealer and I'm looking to get an FCA licence so I can offer car finance but I don't know how to do it. Call 185,"It's just a general enquiry. Ok so, how do we go about submitting an application then, for a credit licence?"Call 186,Basically my brother is the director and he's delegated to me to give you a call to enquire if we need to be registered to take weekly payments from customers. Call 187,"We'll be offering carpets and flooring, carpets and underlay. Do we need to apply to you to be authorised to offer finance options?"Call 188,My colleagues from different places have told us you need to set up with the FCA. I couldn't actually quite understand why we should register with the FCA. We are setting up a new business as a car trading autodealer. What would be the point for registering with the FCA?Call 189,We are going to trade cars and some of our colleagues or let's say friends told us to register with the FCA to offer them t offer them limited permissions financing and so onCall 190,"Basically my question is, I'm dealing with cars. I'm trying to sell cars and I asked one of my friends who is actually dealing with like, finance and he said to contact the FCA."Call 191,I just wanted to get some information on how to start offering creditCall 192,We have an issue at the minute with money lending on site. I was just wondering about the legality or otherwise of personal money lending with interest rates. Call 193,"The reason I am calling is because I just want to know if I need a licence or I need authorisation, because what happened is, I want to lend my friends money, a maximum of 20 friends, between 15 to 20 friends a maximum of ¡ê1000 and then they will pay me for one year, with an interest of ¡ê200."Call 194,"I was ringing to see if I could  get some information, I don't know if it's applicaple to yourself or not. But I mean, the firm that I work for, we have our own accounts department and we look after bringing in debt and owed money. We've been asked by some of our business associates if we could debt collect on their behalf. So I was looking to get some information as to what we would have to do to be able to do that. "Call 195,Basically I need some information on how can I register with the FCA? To sell cars with the finance. Call 196,"I'm just calling to enquire about getting and FCA Firm Reference Number to offer credit. I'm new to all this, I don't know how to go about dealing with it."Call 197,"I want to be able to provide finance, I'm a car dealer. "Call 198,"We're a carpet retailer and we want to offer our customers an option for interest free credit or you know, something like that. "Call 199,"I'm looking for information with regards to how I'd go about getting authorised for, I want to set up a kind of an online comparison website for loans and lending within the UK. "Call 200,"I wanted to find out, I need to apply for limited permissions or full permissions. Basically we are a retail shop. We provide finance through hitachi. Do I need full permissions or limited permissions, or something totally different? "Call 201,"Well the cycle to work scheme, we spoke to them and they advised us that if we wished to raise our maximum certificate value above the maximum ¡ê1000 limit, then we'd need to speak to you to obtain a consumer credit authorisation. "Call 202,"We want to apply for a credit consumer  licence, but we're trying to work out what kind of licence we actually need. Basically we're a car sales company and we're going to be sending information to a third party broker. "Call 203,Basically I'm buying brand new motorbikes and customers  ask for finance . What do I have to do?. Call 204,I would like to have a consumer credit licence because I am providing loans and I would like to have one. Well some are entrepreneurs in the property development sector and sometimes they need funds and I loan the funds to them.  Call 205,"Well, I need a bit of advice about authorisation. Where do things sit with lead generators these days? Generating leads on the behalf lenders. "Call 206,I'm just calling to enquire about getting a consumer credit. I've got a business where I buy and sell cars and I want to be able to offer finance to my customers.Call 207,"I want to start the process of purchasing a consumer credit licence. We sell vehicles, there will be occasions potentially where a client might need to arrange finance in order to purchase that vehicle. I am also offering part exchanges."Call 208,"I just got a few questions, because I'm not quite clued up about the FCA. SO I'm starting up a business where I'll be buying goods and people will be buying it back off me, but they can pay quarterly, so finance, basically. So I'm just asking some questions, what kind of clearance do I need for that and how do I go about doing that."Call 209,We just want some advice on what process we'd need to complete to become authorised. We sell used cars and we want to be able to provide finance for customers Call 210,"This is all relating to an agreement between myself and a friend who has approached me to lend money for the purpose of buying a vehicle, but for profit purposes. So, what I'm wanting to know, is, am I able to lend him my personal money, for a period of six months, in return for a monthly interest rate. Do I need to be an approved, or have any approvals to be able to do this?"Call 211,"Just a quick enquiry, what it is, I want to set up a little, small office, to pass on work to brokers for mortgages and loans and all that. So what kind of licence would I require to do that?"Call 212,How do I apply apply for a credit licence?Call 213,"I'm looking to become authorised, I'm looking for some advice on becoming authorised in regards to retail finance. "Call 214,"I'm looking to basically start my own business, selling gaming laptops. So obviously, what I'm looking for advice on is, how I become regulates, so, instead of me having to go to a retail finance company, I can do it myself, so I can charge a lower APR if that makes sense?"Call 215,"I'm a car dealership, I sell cars for a living. I don't currently offer finance myself. A lDo I need to offer finace and how do I go about it?"Call 216,"I sell cars and I understand that if I want to offer finance, I have to have a limited car dealership licence?"Call 217,"I'm looking at a new business, which is renting vehicles, renting cars, to consumers. Now, I own them, but they can have the option of purchasing them if they want. Would I fall under your parameters? "Call 218,"I've got a client who has a straight forward situation where an adult wants to provide a loan to help purchase a house for the son. Clearly that person doesn't have to be authorised under the FCA regime because they're not doingit as a business, I'm quite clear about that. But the consumer credit act element, I'm a bit confused about, as to whether there is an exemption there or not; whether any of the act applies?"Call 219,"I was wondering, what would be the rules in regards to maybe split payments for patients? Because I remember that dental practices should be registered with the FCA if they do provide a staggered payment. "Call 220,"Do I need to look at the Consumer Credit Act in any way, shape or form to offer finance?"Call 221,I'm selling passive exercise bikes for disabled people and I want to offer finance for them on my website. Do I need to the FCA for that?Call 222,"I just want to make sure, do I need any licencing or anything to carry out my duties? I've got a company and we set up tablets. So we are programmers, so we have a small team here and the majority of the programmers are abroad. What we do is we set up tablet screens where individuals can enter an application, all of the supportive details onthere and process the direct debits. I'm just not sure, if you're a business, do you need a consumer credit licence, because it contains the word 'consumer'? It's a B2B, it's going through 'go cardless' - a third party direct debit, do I still need a consumer credit licence? "Call 223,"I've been talking to this firm who is happy to provide my customers with finance, but they are asking for me to get an FCA licence first so they can actually give it for more than 12 months, otherwise my customers would be restricted to paying it in 12 months. Is this correct?"Call 224,"I was just considering whether it was worthwhile me to get into or not, or to stick to 12 months. If we want to offer our customers more than 12 months of finance, what do we have to do?"Call 225,"Before I file for it, do I need to have a retail finance company on my side, or can we just do it without it and once we do get a licence, can we go after these finance companies?"Call 226,I'm looking at setting up a vehicle leasing and brokerage. Call 227,I've been told because of my professional services work I may do from time to time that I have to differentiate what would fall under a consumer credit licence.Call 228,"I sell cars through finance, I've been told I must get FCA limited permissions to be able to do that."Call 229,"I'm a second car dealership and I've just started my business and I want to be able to offer my customers finance, I've been told my need to registered or authorised"Call 230,"I've been told that I need to register with the Financial Conduct Authority, in order to continue offering finance to our dental patients."Call 231,"We're an online furniture retailer, we'd like to be able to offer customers a possiblity to purchase sofas over longer periods like credit terms. I've been told that we need to apply for this FCA regulation, is that right?"Call 232,If we're passing a customer on to someone who is FCA registered I've been told we need to be registered for credit broking is that right?Call 233,"I was looking to take some advice and direction, I'm a sole trader car dealer and looking for authorisation to enable me to offer finance deals to customers."Call 234,Do I need an FCA licence to offer credit broking?Call 235,Do I need to apply for credit broking if I am retailer? Call 236,What I'm looking for is whether credit broking is regulated or unregulated.Call 237,Can you advise if I need Credit broking or not to ofgfer finance to our customers?Call 238,"I'm wanted some advice first as I'm not sure what type I'd need, whether it's limited or full permission"Call 239,"From what I've been told from the 3rd party company, if you're offering interest free only then you don't need FCA licensing"Call 240,We have been told that it might be a good idea to register with the FCA so we can give debt adviceCall 241,I've been asked to enquire and obtain a Consumer Credit licence to lend moneyCall 242,I've been told that I need to set up a Consumer Credit Licence to provide clients with financeCall 243,We are a veterinary practice and looking to offer credit.Call 244,"We're a golf club looking to offer our members finance via a 3rd party, who would I go to get some assistance"Call 245,"If you can issue Consumer credit loans to your customers, can you also hold a credit broking licence at the same time?"Call 246,Do I need permission from any people to open a pawn shop?Call 247,How do I apply for Limited Permission?Call 248,Do I need to be authorised to lend money on an individual basis?Call 249,"I want to get a loan based crowd funding online platform established in the UK, how do I do this?"Call 250,"We're a car sales company, I want to start offering car finance through a lender, how do I become FCA approved?"Call 251,"If we want to advice someone on their debts and consolidating them, does that require a licence?"Call 252,If we let customer pay us in instalments do we need to be authorised?Call 253,Am I credit broking if I refer customers to a lender?Call 254,"We hire luxury watches on a 6-12 month contract, would this be consumer hire or credit broking?"Call 255,How can I be authorised to sell my cars on finance?Call 256,We're looking into offering finance for customers we sell cars to and we've been told we need to be FCA regulatedCall 257,"Why do we need to registered with the FCA as a dental practice, we only offer finance through another company?"Call 258,We're opening a car dealer and looking to offer customers finance on our website. Do we need to let you know?Call 259,We are going to be offering finance via a 3rd party and selling insurance product. Does this require authorisation?Call 260,I want to get authorisation to provide financial services i.e. loan. How do I go about it?Call 261,"We want to do in-house finance, where we refer to external company. What does that involve?"