Call 1,"I've been told that I need to apply for a licence to sell my goods If we sell consumers credit, can we offer 12 months interest free credit without the licence?"Call 2,we've been told we don¡¯t need a licence to sell credit but been the rates are our business would pay the finance companies would be a lot higher than to be not entirely regulated  but if we get a licence and get regulated that¡¯s gonna bring the rates of the finance downCall 3,Been told by the national Prawn brokers association that I need to go down this route of the financial conduct authority to get a consumer credit license. Is that correct?Call 4,"If I wanted to set up on my own website which does not do credit checks and no one takes fee now anyway,  but pass details on to a lender or a master broker, do I still have to apply for full permission."Call 5,"I've been told best speak to you about some advice on what we need to do with the FCA. If were not offering any finance and its just sale or return cars, do we need to regsitered? "Call 6,"I'm a little bit confused, I just need to get some help, we sell e pods equipment and we recommed a couple of brokers, or people that lease the gear or come up with finance or want some options, we don't get involved we just recommned that speak to this person or that person, we sort of been hinted that we need to get approved by you guys to do that, is that true? "Call 7,"If I want to introduce business to banks, or commerical activities and I introduce them to a bank and do all the due dillgence, what licence do I need to have or what permissions do I need to have?"Call 8,What does Credit broking licence allow me to do?Call 9,Do I need to to be regulated or licenced if I offer a monthly payment to my customers to pay for their boilers?Call 10,Looking to register my company to be FCA regulated to offer financeCall 11,I am plumber and looking to sighn up with the Hitachi finance scheme which offers 10 months interest free. How do I go about it?Call 12,"I am a car dealer, just spoekn to a finance company and apparently I have to be FCA regulated to offer any fnancial products to customers through them. Looking at the website so many different schemes, quite hard to make heads tails which I need to be. They said something about a  small payment services where you can offer it through them but not through myself if that make sense. "Call 13,"I've spoke to the financial broker panel, and they guide/said to give you a call to get auothorised as a finanical broker. "Call 14,If we were/are providing/offering finance but not through oursleves but through an outside source do we need to registered?  Call 15,"from time to time I do make loan profit, I don¡¯t advertise but I people come to me privately. Do I need to be authorised? "Call 16,Want to know whether what I want to do and have done once or twice is infact lawful or needs regulation for lendingCall 17,"I am opening/building a website at the moment and wondering if I need to be authorised by yourselfs, don't know how it works. Not sure if I do need Prduct comparsions website."Call 18,"I have a kitchen company and wanting to offer finance through a third party, am I going to need a Credit licence, need some advice on that. What I want to is introduce/ broker to my customer so they can privide a personal loan and want to be able to advertise that I do finance. so I'm going to need a credit licence to do that, is thereone kind of licence or various ones. "Call 19,"I wanted some advice, I'm a sole trader and looking to start a carpet business where by they pay a third deposit and let them pay the balance over 3 month in 3 payment interest or gentlemans agreement, Do I need a licence to do that?"Call 20,"I'm a relationship manager for clients of HSBC bank, one of my clients are debt collection agency,  business to business, do they need to be authorised?"Call 21,"I'm just opened my own business a couple weeks ago selling exspensive furntiure, of course to boost selling and things like I was hopeing to get FCA approved and go through a finance company. "Call 22,"We are a firm licenced insolvency practice in Scotland under the Chartered accountant consumer credit licence, I'm an approved debt arrangement scheme advisor and would still like to conitnue debt advice under middlebrookes, my understanding is that we need some kind of FCA authorisation if we look to ofer debt arrangement scheme. "Call 23,"I'm calling  from quest corporation, looking to advertise car leases for our partners, only deal with admin side, we don't deal with any of the finance, do we need to do anuthing with you?"Call 24,"We've found more and more that people are asking for advice on debt, housing and benefit, trying to get some training for our volunters in these areas and been told that we have to be authorised by the FCA. "Call 25,"Started a new business in electrics, I'm an Electrician I'm really looking for advice f how I  can become register as I want to start off smart home technology in peoples houses, whether I can go about bcoming FCA register so I can essentially start offering finance. "Call 26,One of my suppliers abroad has told me that they want me to have a FCA license. Call 27,I'm looking for a little bit guidance please? On whether a finance deal would be regulated or unregulated. Call 28,"Ive been trying to make an application but I'm stuck, I don¡¯t know what to do. My business is a furitnure business and wanting to do, buy a sofa of me and wanting to pay monthly or wanting to introduce them to a thrid party"Call 29,"For our customers who buy our products on finance, we need to get FCA approved or registered, I just wanted to know what the procedures was, what are the criterias, what do you need to become register"Call 30,want to offer credit though a finance company and most of the credit lenders say that we have to have an FCA approval. Do we have to register with you?Call 31,"looking to offer financial products, where the customer will get the option to pay on finance, stright away or in installments."Call 32,"Trying to establish whether doing a fact find on an individual and saying to them because of the debts you¡¯ve got I'd suggest I put you in touch with an insolvency practioner who will deal with setting up a debt management plan or an IVA,  will be regulated?"Call 33,What does fall under debt counselling and do I need further debt counselling permissions?Call 34,"I understand certain levels of registration depending on what conduct you're carrying out. What level does it need to be as far as us signing people up on a credit agreement, for a credit company that we would be working with, us being able to provide it through finance, need to know what is required from us by the FCA in order for us to be able to do this"Call 35,"I've got a vehicle forecourt, I sell vans, I am selling some expensive stuff up here, over ¡ê3000 they want to do it with finance, what is involved, how do I go about getting a finance licence, can you point me in any direction. I imagine I will have company customers and joe public as well. ""I've been told the more you sell on finance you get a cheque back"""Call 36,"I,ve been told by the financial company that I want to work with that I need to get financial broking permissions."Call 37,"We are looking to get customer finance for people to buy their watches, what kind of FCA form do I need, is it Llimited or full? "Call 38,"I have a car van hire company and offer credit to customers to take a vehicle over 1 -2  years, and then own the vehicle at the end of it and then pay us a credit fee rather than a rental fee. What do I need? "Call 39,"Do I need to apply for full or limited authorisation, we deal with 2nd hand cars, to offer finance to our customers we refer them to a finance company, do we need a consumer licence? "Call 40,"I've got vehicles, I buy vehicles, i want to be inbetween the finance company and the broker, the broker goes to the finance company and I deal with the broker. for me to be able to receive payment for a vehicle I have to have something from the FCA, what is that?"Call 41,"We want to start a new model where we rent them to customers rather than sell them. Do we need to reguated by you, and if so, what level of regulation do we need?"Call 42,"What I needed to do whether or not I needed a CC licence? Just an online retailer, just an online shop, I wouldn¡¯t be offering paying in installments"Call 43,"one of the things we want to do is to be able to offer our customers some sort of credit facility, not directly, well probably be going through Barclays bank. Understand we have to have Account Licence in order to be able to pass our customers to Barclays. "Call 44,"I want to borrow ¡ê500 to one of my friends, just a one off thing im doing as a favour, but im also charging interest, do I need to have a licence to borrow that money. I want to make sure I can recuperate the money legally if they cant pay "Call 45,"im looking to start a buisness, like a vehicle broker, so car leasing van leasing, im not a lender, I go out find the best deal at dealerships, advertise their prices and they¡¯ll come to me and I'll point them in the direction they need to go and I just charge a fee for doing that. I've come to decision I need to apply for limited permisions. Is this correct."Call 46,WI am plumber and want to help my customers with paying the bills. What do I do?Call 47,"I want to begin providing credit with a finance company, act as brokers so we can offer interest free credit to our customers. What does this involve?"Call 48,"Im wondering what the law is in taking installment payments for holiday lets? I was told to contact yourself? Ive got a couple of holiday lets that I rent out and people ask to pay in installments, are you allowed to take installment payments?"Call 49,"If I introduce a client to somebody who will provide them with securities, like lending, invoice discounts,  do I need to have a licence to do that or can I just pass them on provided I tell them that Im passing them on and Ill get a fee back from the people that I intoduce them to"Call 50,"We are looking to do some credit agreements for some of our drivers, where we could pay for peoples licence upgrades and they can pay us back. What do we have to do?"Call 51,just set up a new busienss car dealing and I need to get registered with you to be able to do finance is that right?Call 52,I sell 2nd hand cars. Want to be able to offer finance incentives with close brothers and like leasing Call 53,"don¡¯t directly do finance, we hand them over to finance, want to become FCA registered so I can directly transfer the customer what do I need to do? "Call 54,"I take details, submit to finance company, go to Underwriters who make a decision whether be accepted or not. Technically car being sold to the finance company and you as the consumer will be making payments to the finance companyI will give you 5K for your car and the remaining balance added onto the new finance to the new finance you take out. Do I need to register with you?"Call 55,"I hire something for 3 months, and then at the end of the agreement they hire it again, is this a new hire and therefore does not require authorisation, or is it the same hire because its the same person same item? "Call 56,"what permissions do we need, whether our organisation is authorised for the consumer hire business permission. An agreement between the employer and the cycle to work scheme, all the NHS does is collect the payment. Do we need to register?"Call 57,If you're offering 12 months at 0% interest on installments do we have to be authorised?Call 58,How do I get a debt adjusting licence? Call 59,I need limited permsission. I don¡¯t know what the difference is.Call 60,I've been told by a finance company that I need debt adjusting what is this?Call 61,what would be involved in getting a credit licence to provide finance to customers Call 62,"We hire out baby equipment and when we looked on your website it says if people hire for more than 3 months then you have to be registered. None of the clients hire for 3 months in first instance, but they're free to renew as often as they want, didnt know if that then classed as hiring for 3 months or not?"Call 63,"USED CAR DEALERSHIP, LTD vat REGISTERED, LOOKING AT DOING FINANCE WITH A BROKER COMPANY, simply a broker agreement that part says FCA DPA registeration, says you need to be authorised by the FCA. Firm is just introducing them to finance company"Call 64,"checking on what I need to do,  my trading association says I need to hold and maintain FCA authorisation for consumer credit"Call 65,"If were never gonna lend money, were gonna say we can offer finance and this is the company that will lend you the money, but they don¡¯t give us any money back, do we need a credit licence "Call 66,"I used to have FCA licence and I have gone back into selling cars again, can I renew my old FCA licence? I will be refering them to finance company."Call 67,"Thinking about going into car sales, what sort of licence will we need? We won't do the finance but will use outside firm, do we need a licence to recommend this firm?"Call 68,"Require authorisation, do I need to be registered if I am doing cleaning activities and offer people 10 months regular payments?"Call 69,"Not registered yet, want to set up business where people purchase a vehicle and I refer them to a finance company, would I need to be FCA registered?"Call 70,"Setting up new company and becoming FCA approved, offering car finance and we would be the broker. I know we do definitely need the FCA because finance companies would not work with us."Call 71,"Trying to set up a broker company, what do I need to do, set up a limited company first or if I set up as a sole-trader, what permissions do I need?"Call 72,"We are a retail business looking to offer finance, finance company said we need to register with the FCA to sell products under ¡ê25,000. "Call 73,"Would like to know a bit more info how we became part of your team, we are hot tub company, would like to apply to Hitachi finance company but do I have to be a member with you?"Call 74,"I am after a bit of advice, new company offering training courses, want to offer students finance. Speaking to company that can offer our students finance, but they are not FCA registered, what are the guidelines regarding the FCA and being authorised."Call 75,"If I was going to introduce buy-to-let business, would I need authorisation or permissions to do that? I want to act as an introducer, would I need to be authorised?"Call 76,I would like to find out about applying and some guidance on debt recovery.Call 77,"New car dealership and like to offer finance, do I need to get a FCA licence before I can do anything? "Call 78,"I had a consumer credit licence 15 years ago and I was made bankrupt, can I get another licence?"Call 79,"I would like to know if I can qualify to register with FCA for consumer credit, we want to be the middle man between the creditor and the debtor."Call 80,"We sell telephone systems but don't have consumer credit licence, I would like to apply for this, so we can provide leasing to our customers."Call 81,"Limited company looking to provide leasing options for customers to buy coffee machines, will be a credit broker and using a 3rd party provider, is this the right type of application for consumer credit?"Call 82,"Window installation company wants to provide finance, need advice how to get credit broking licence. "Call 83,I want to find out if I need a credit licence for lending.Call 84,"I am after some information about a consumer credit licence, we want to offer credit options to our customers through a 3rd party."Call 85,"How do I became registered and when do I need to be FCA registered, we are a renovation company and want to offer finance facility. "Call 86,"I want to go into lending, are there any new regulatory changes and anything new to the market? "Call 87,"Launching business selling domestic boilers and need to provide credit facility, I need guidance on my options."Call 88,"How do I get FCA regulated and get a consumer credit licence for limited permissions, I have a car dealership and want to be a broker. "Call 89,"Looking at becoming a car & van leasing broker, I want to understand the set up to do this and can I get authorised for permissions."Call 90,"I want to offer car finance, I require information about what to do to implement this and how it works. "Call 91,"I want to make sure that we do need to be licenced for the FCA, when I spoke to our leasing company they said we shouldn't need to be regulated, we supply products and coffee equipment. "Call 92,"We supply photocopiers and refer people to the leasing company, do we need to have a consumer credit licence?"Call 93,"I have a car dealership and want to offer car finance through a broker, the finance company directed me to you and I was told I need an FCA licence."Call 94,"Need to get a new licence, do I need to start the process again."Call 95,"I buy and sell cars, I want to know if I do finance for my customers, the finance company said I need to be registered by the FCA."Call 96,"How can I make my firm regulated or apply to have it regulated, we do lending and I want to explore the option of being FCA regulated. "Call 97,"I supply gym equipment using 3rd party leasing company, they said I need to get FCA licence, am I a consumer credit firm and can you tell me what I fall into?"Call 98,"Looking into lending industry, we don't know what we require in order to do this."Call 99,"Looking for advice, we are a replacement window company and I used to have consumer credit licence which lapsed, looking to re-apply to became authorised again. "Call 100,"Setting up new business for financial advice or debt management service, do I need to get authorised?"Call 101,I was asking about consumer hire agreements and if they are regulated activities.Call 102,Setting up as vehicle finance broker what do I need to apply for?Call 103,"Not sure whether we need to be authorised or go for a licence or not? We are fabric retailers and want to offer interest free credit, we need to look into if this is feasible. "Call 104,"Making an enquiry about registering, my intentions are to open a pawnbroking service, I understand I need a consumer credit licence."Call 105,"Looking to get authorised to offer finance on cars, debt adjusting and debt counselling activities. "Call 106,"Looking to get authorised and to be regulated, I don't know if a credit broker needs to be limited or have full permission? I am in two minds which is which because they all sound similar."Call 107,"We are a limited company wanting to lend, is this allowed or do they need to seek authorisation before lending? "Call 108,I'm a dental pratcice do I need to apply to you?Call 109,"I'm just looking for a bit of advice really, I'm a little bit confused with the FCA website and where I sort of need to start. So, I'm in the process of setting up a used car dealership and I want ot offer fincance to customers. I just want to know do I need to apply for FCA approval or not?"Call 110,"So I'm setting up a used car sales business and I'm looking for a bit of advice on exactly what I need to do to become FCA qualified as such or what the correct word is - authorised. Where to start I suppose, I mean every step we need to take to be FCA authorised to offer finance. "Call 111,"What we're looking to do, is to look at employing a debt advisor for our tenants. But I think that takes us to the next level of authorisation. I want to know what I need to do to get that. "Call 112,"Do we have to be, if our team was to start giving debt advice, contacting companies to make arrangments and that sort of thing and talk about bankruptcy opr whatever, do we be a member of the FCA or does there have to be a level of training that has to be done?"Call 113,"We're being told by one of our commissioners that we need to be FCA registered, but we can't quite see where we fit into it. We collect rent on behalf of tennants, but we also offer budgetary advice. Do we need to be authorised?"Call 114,"I was just after some information if possible please. I'm working at a business at the moment, we are plumbers and they've asked me to get in touch with you to look into something for them. What we're wanting to do, is well, we install boilers. We wanted to introduce a credit scheme, so customers could get them on credit, and I've been told we'd need to be FCA registered to do that. I've had a look at the website and I'm baffled by the terminology on there."Call 115,"We're a shopfitting company and often the people we're shop fitting for want funding and we pass these people to Henry Howard, the finance company. Do we have to inform you and how?"Call 116,How much of a licence do have to offer finance?Call 117,How do I register with the FCA for a licence?Call 118,"If I were to become a commercial finance broker, do I need an authorisation, as in an FCA authrorisation at all? I'll be looking to offer you business finance, it could be a business cash advance."Call 119,"Now, we have been told that we need to move into giving debt advice. I don't know if we should be regulated in some form"Call 120,"Well, we were speaking to a finance company about offering leasing agreements and they've suggested we might want to look at getting category C lincenced for sole traders and that, and I'm just looking for some advice on that "Call 121,"We are an IT and security company, and we spoke to a company about providing leasing agreements to some of our customers as a potential payment method."Call 122,I want to be authorised to offer finance and I want to know what's involved Call 123,Do I need any special permissions or any licence to sell my bikes?Call 124,What kind of registration do I need to offer finance for the cars I sell?Call 125,"Now, I wanted to know what kind of, do we need to be registered, do we need to be authorised? What do we need to do in terms of the FCA? We are a vet"Call 126,They're saying the requirement is that I need a credit licence from the FCA. How do I have to do that?Call 127,"I'm looking to set up a debt collection agency and I want some advice, what basically do I need? Do I need to be registered with any bodies or anything like that?"Call 128,"Who would be authorised to do that for actually selling the cars, because if a customer wants a car but doesn't have the money, they'd need someone to finance that "Call 129,"I was just phoning for some advice. I'm not sure if it'd be require, and if it is, I just wanted to know how potentially, we could be authorised. We lease vending machines"Call 130,I was just wondering what the guidelines are for offering part payment without any interest for equipment Call 131,"I was wondering if you could give me just a short bit of advice. I am about to launch a new product, we have got a finance company that is happy working with us when someone is purchasing one of our units, that we refer them to the finance house, and they'll then look after everything form there, we don't fill in any forms or anything, all we do is introduce the two of them and they look after everything, and then once we supply the product, the finance house will pay us. Do we need to have any authorisation or anything?"Call 132,Me and my work partner we're thinking of introducing a company which provides short term loan leads. Do we need to apply to you?Call 133,"If I were to become a commercial finance broker, would I need authorisation?"Call 134,"If I were to become a commercial finance broker, do I need an authorisation, as in an FCA authrorisation at all? I'll be looking to offer business finance, it could be a business cash advance."Call 135,I'm looking to get some advice on detailed finance so that my cuustomers can buy products on finance. We sell hair extensions on and I've seen some companies do this but I'd like to do it the right way because I've seen a lot of companies offer products on finance.Call 136,"I just wanted to speak to somebody about what I have to do, what the law requires me to do, to get registered by the FCA so I can provide finance. "Call 137,"I supply six month old cars to companies, basically, that's what we do and we've been going a long time. More and more recently these companies have moved towards leasing their vehicles and doing contract hire. Now I'm not sure what the situation is for me in regard to doing business along those terms. They pay me and off we go. My question is, the companies I'm dealing with, some of them are moving towards, instead of buying the cars outright, are moving towards what's called contract hire and leasing these vehicles. I'm not sure what, in today's society, what I can say to them, what I can't, can I do business with them, can I supply them with a lease, I don't have a consumer credit licence anymore, I used to.  What do I need to do and how much does that cost?"Call 138,"What it is, I'm trying to register for a limited licence and I'm trying to uderstand the process for it. We are looking to sell, we're a wholesaler, we don't send to end users, we're looking to sell products to end users via distributers. So we have a leasing company that we could potentially use but we need to be registered under the FCA, using an FCA licence to point people in the right direction of this leasing company.  "